00:00.0 Host bridge [0600]: Intel Corporation Device [8086:5914] (rev 08)
	Subsystem: Dell Device [1028:082a]
	Flags: bus master, fast devsel, latency 0
	Capabilities: [e0] Vendor Specific Information: Len=10 <?>
00: 86 80 14 59 06 00 90 00 08 00 00 06 00 00 00 00
10: 00 00 00 00 00 00 00 00 00 00 00 00 00 00 00 00
20: 00 00 00 00 00 00 00 00 00 00 00 00 28 10 2a 08
30: 00 00 00 00 e0 00 00 00 00 00 00 00 00 00 00 00

00:02.0 VGA compatible controller [0300]: Intel Corporation Device [8086:5917] (rev 07) (prog-if 00 [VGA controller])
	Subsystem: Dell Device [1028:082a]
	Flags: bus master, fast devsel, latency 0, IRQ 279
	Memory at db000000 (64-bit, non-prefetchable) [size=16M]
	Memory at 90000000 (64-bit, prefetchable) [size=256M]
	I/O ports at f000 [size=64]
	[virtual] Expansion ROM at 000c0000 [disabled] [size=128K]
	Capabilities: [40] Vendor Specific Information: Len=0c <?>
	Capabilities: [70] Express Root Complex Integrated Endpoint, MSI 00
	Capabilities: [ac] MSI: Enable+ Count=1/1 Maskable- 64bit-
	Capabilities: [d0] Power Management version 2
	Capabilities: [100] Process Address Space ID (PASID)
	Capabilities: [200] Address Translation Service (ATS)
	Capabilities: [300] Page Request Interface (PRI)
	Kernel driver in use: i915
	Kernel modules: i915
00: 86 80 17 59 07 04 10 00 07 00 00 03 00 00 00 00
10: 04 00 00 db 00 00 00 00 0c 00 00 90 00 00 00 00
20: 01 f0 00 00 00 00 00 00 00 00 00 00 28 10 2a 08
30: 00 00 00 00 40 00 00 00 00 00 00 00 ff 01 00 00

00:04.0 Signal processing controller [1180]: Intel Corporation Xeon E3-1200 v5/E3-1500 v5/6th Gen Core Processor Thermal Subsystem [8086:1903] (rev 08)
	Subsystem: Dell Device [1028:082a]
	Flags: fast devsel, IRQ 16
	Memory at dc420000 (64-bit, non-prefetchable) [size=32K]
	Capabilities: [90] MSI: Enable- Count=1/1 Maskable- 64bit-
	Capabilities: [d0] Power Management version 3
	Capabilities: [e0] Vendor Specific Information: Len=0c <?>
	Kernel driver in use: proc_thermal
	Kernel modules: processor_thermal_device
00: 86 80 03 19 02 00 90 00 08 00 80 11 00 00 00 00
10: 04 00 42 dc 00 00 00 00 00 00 00 00 00 00 00 00
20: 00 00 00 00 00 00 00 00 00 00 00 00 28 10 2a 08
30: 00 00 00 00 90 00 00 00 00 00 00 00 ff 01 00 00

00:14.0 USB controller [0c03]: Intel Corporation Sunrise Point-LP USB 3.0 xHCI Controller [8086:9d2f] (rev 21) (prog-if 30 [XHCI])
	Subsystem: Dell Device [1028:082a]
	Flags: bus master, medium devsel, latency 0, IRQ 124
	Memory at dc410000 (64-bit, non-prefetchable) [size=64K]
	Capabilities: [70] Power Management version 2
	Capabilities: [80] MSI: Enable+ Count=1/8 Maskable- 64bit+
	Kernel driver in use: xhci_hcd
00: 86 80 2f 9d 06 04 90 02 21 30 03 0c 00 00 80 00
10: 04 00 41 dc 00 00 00 00 00 00 00 00 00 00 00 00
20: 00 00 00 00 00 00 00 00 00 00 00 00 28 10 2a 08
30: 00 00 00 00 70 00 00 00 00 00 00 00 ff 01 00 00

00:14.2 Signal processing controller [1180]: Intel Corporation Sunrise Point-LP Thermal subsystem [8086:9d31] (rev 21)
	Subsystem: Dell Device [1028:082a]
	Flags: fast devsel, IRQ 18
	Memory at dc434000 (64-bit, non-prefetchable) [size=4K]
	Capabilities: [50] Power Management version 3
	Capabilities: [80] MSI: Enable- Count=1/1 Maskable- 64bit-
	Kernel driver in use: intel_pch_thermal
	Kernel modules: intel_pch_thermal
00: 86 80 31 9d 02 00 10 00 21 00 80 11 00 00 00 00
10: 04 40 43 dc 00 00 00 00 00 00 00 00 00 00 00 00
20: 00 00 00 00 00 00 00 00 00 00 00 00 28 10 2a 08
30: 00 00 00 00 50 00 00 00 00 00 00 00 ff 03 00 00

00:15.0 Signal processing controller [1180]: Intel Corporation Sunrise Point-LP Serial IO I2C Controller #0 [8086:9d60] (rev 21)
	Subsystem: Dell Device [1028:082a]
	Flags: bus master, fast devsel, latency 0, IRQ 16
	Memory at dc433000 (64-bit, non-prefetchable) [size=4K]
	Capabilities: [80] Power Management version 3
	Capabilities: [90] Vendor Specific Information: Len=14 <?>
	Kernel driver in use: intel-lpss
	Kernel modules: intel_lpss_pci
00: 86 80 60 9d 06 00 10 00 21 00 80 11 10 00 80 00
10: 04 30 43 dc 00 00 00 00 00 00 00 00 00 00 00 00
20: 00 00 00 00 00 00 00 00 00 00 00 00 28 10 2a 08
30: 00 00 00 00 80 00 00 00 00 00 00 00 ff 01 00 00

00:15.1 Signal processing controller [1180]: Intel Corporation Sunrise Point-LP Serial IO I2C Controller #1 [8086:9d61] (rev 21)
	Subsystem: Dell Device [1028:082a]
	Flags: bus master, fast devsel, latency 0, IRQ 17
	Memory at dc432000 (64-bit, non-prefetchable) [size=4K]
	Capabilities: [80] Power Management version 3
	Capabilities: [90] Vendor Specific Information: Len=14 <?>
	Kernel driver in use: intel-lpss
	Kernel modules: intel_lpss_pci
00: 86 80 61 9d 06 00 10 00 21 00 80 11 10 00 80 00
10: 04 20 43 dc 00 00 00 00 00 00 00 00 00 00 00 00
20: 00 00 00 00 00 00 00 00 00 00 00 00 28 10 2a 08
30: 00 00 00 00 80 00 00 00 00 00 00 00 ff 02 00 00

00:16.0 Communication controller [0780]: Intel Corporation Sunrise Point-LP CSME HECI #1 [8086:9d3a] (rev 21)
	Subsystem: Dell Device [1028:082a]
	Flags: bus master, fast devsel, latency 0, IRQ 287
	Memory at dc431000 (64-bit, non-prefetchable) [size=4K]
	Capabilities: [50] Power Management version 3
	Capabilities: [8c] MSI: Enable+ Count=1/1 Maskable- 64bit+
	Kernel driver in use: mei_me
	Kernel modules: mei_me
00: 86 80 3a 9d 06 04 10 00 21 00 80 07 00 00 80 00
10: 04 10 43 dc 00 00 00 00 00 00 00 00 00 00 00 00
20: 00 00 00 00 00 00 00 00 00 00 00 00 28 10 2a 08
30: 00 00 00 00 50 00 00 00 00 00 00 00 ff 01 00 00

00:1c.0 PCI bridge [0604]: Intel Corporation Sunrise Point-LP PCI Express Root Port #1 [8086:9d10] (rev f1) (prog-if 00 [Normal decode])
	Flags: bus master, fast devsel, latency 0, IRQ 120
	Bus: primary=00, secondary=01, subordinate=39, sec-latency=0
	I/O behind bridge: 00002000-00002fff
	Memory behind bridge: c4000000-da0fffff
	Prefetchable memory behind bridge: 00000000a0000000-00000000c1ffffff
	Capabilities: [40] Express Root Port (Slot+), MSI 00
	Capabilities: [80] MSI: Enable+ Count=1/1 Maskable- 64bit-
	Capabilities: [90] Subsystem: Dell Device [1028:082a]
	Capabilities: [a0] Power Management version 3
	Capabilities: [100] Advanced Error Reporting
	Capabilities: [140] Access Control Services
	Capabilities: [220] #19
	Kernel driver in use: pcieport
	Kernel modules: shpchp
00: 86 80 10 9d 07 04 10 00 f1 00 04 06 00 00 81 00
10: 00 00 00 00 00 00 00 00 00 01 39 00 20 20 00 20
20: 00 c4 00 da 01 a0 f1 c1 00 00 00 00 00 00 00 00
30: 00 00 00 00 40 00 00 00 00 00 00 00 ff 01 10 00

00:1c.4 PCI bridge [0604]: Intel Corporation Sunrise Point-LP PCI Express Root Port #5 [8086:9d14] (rev f1) (prog-if 00 [Normal decode])
	Flags: bus master, fast devsel, latency 0, IRQ 121
	Bus: primary=00, secondary=3a, subordinate=3a, sec-latency=0
	Memory behind bridge: dc000000-dc1fffff
	Capabilities: [40] Express Root Port (Slot+), MSI 00
	Capabilities: [80] MSI: Enable+ Count=1/1 Maskable- 64bit-
	Capabilities: [90] Subsystem: Dell Device [1028:082a]
	Capabilities: [a0] Power Management version 3
	Capabilities: [100] Advanced Error Reporting
	Capabilities: [140] Access Control Services
	Capabilities: [200] L1 PM Substates
	Capabilities: [220] #19
	Kernel driver in use: pcieport
	Kernel modules: shpchp
00: 86 80 14 9d 07 04 10 00 f1 00 04 06 00 00 81 00
10: 00 00 00 00 00 00 00 00 00 3a 3a 00 f0 00 00 20
20: 00 dc 10 dc f1 ff 01 00 00 00 00 00 00 00 00 00
30: 00 00 00 00 40 00 00 00 00 00 00 00 ff 01 10 00

00:1c.5 PCI bridge [0604]: Intel Corporation Sunrise Point-LP PCI Express Root Port #6 [8086:9d15] (rev f1) (prog-if 00 [Normal decode])
	Flags: bus master, fast devsel, latency 0, IRQ 122
	Bus: primary=00, secondary=3b, subordinate=3b, sec-latency=0
	Memory behind bridge: dc300000-dc3fffff
	Capabilities: [40] Express Root Port (Slot+), MSI 00
	Capabilities: [80] MSI: Enable+ Count=1/1 Maskable- 64bit-
	Capabilities: [90] Subsystem: Dell Device [1028:082a]
	Capabilities: [a0] Power Management version 3
	Capabilities: [100] Advanced Error Reporting
	Capabilities: [140] Access Control Services
	Capabilities: [200] L1 PM Substates
	Capabilities: [220] #19
	Kernel driver in use: pcieport
	Kernel modules: shpchp
00: 86 80 15 9d 07 04 10 00 f1 00 04 06 00 00 81 00
10: 00 00 00 00 00 00 00 00 00 3b 3b 00 f0 00 00 20
20: 30 dc 30 dc f1 ff 01 00 00 00 00 00 00 00 00 00
30: 00 00 00 00 40 00 00 00 00 00 00 00 ff 02 10 00

00:1d.0 PCI bridge [0604]: Intel Corporation Sunrise Point-LP PCI Express Root Port #9 [8086:9d18] (rev f1) (prog-if 00 [Normal decode])
	Flags: bus master, fast devsel, latency 0, IRQ 123
	Bus: primary=00, secondary=3c, subordinate=3c, sec-latency=0
	Memory behind bridge: dc200000-dc2fffff
	Capabilities: [40] Express Root Port (Slot+), MSI 00
	Capabilities: [80] MSI: Enable+ Count=1/1 Maskable- 64bit-
	Capabilities: [90] Subsystem: Dell Device [1028:082a]
	Capabilities: [a0] Power Management version 3
	Capabilities: [100] Advanced Error Reporting
	Capabilities: [140] Access Control Services
	Capabilities: [200] L1 PM Substates
	Capabilities: [220] #19
	Kernel driver in use: pcieport
	Kernel modules: shpchp
00: 86 80 18 9d 07 04 10 00 f1 00 04 06 00 00 81 00
10: 00 00 00 00 00 00 00 00 00 3c 3c 00 f0 00 00 20
20: 20 dc 20 dc f1 ff 01 00 00 00 00 00 00 00 00 00
30: 00 00 00 00 40 00 00 00 00 00 00 00 ff 01 10 00

00:1f.0 ISA bridge [0601]: Intel Corporation Device [8086:9d4e] (rev 21)
	Subsystem: Dell Device [1028:082a]
	Flags: bus master, medium devsel, latency 0
00: 86 80 4e 9d 07 00 00 02 21 00 01 06 00 00 80 00
10: 00 00 00 00 00 00 00 00 00 00 00 00 00 00 00 00
20: 00 00 00 00 00 00 00 00 00 00 00 00 28 10 2a 08
30: 00 00 00 00 00 00 00 00 00 00 00 00 00 00 00 00

00:1f.2 Memory controller [0580]: Intel Corporation Sunrise Point-LP PMC [8086:9d21] (rev 21)
	Subsystem: Dell Device [1028:082a]
	Flags: fast devsel
	Memory at dc42c000 (32-bit, non-prefetchable) [size=16K]
	Kernel driver in use: intel_pmc_core
00: 86 80 21 9d 02 00 00 00 21 00 80 05 00 00 80 00
10: 00 c0 42 dc 00 00 00 00 00 00 00 00 00 00 00 00
20: 00 00 00 00 00 00 00 00 00 00 00 00 28 10 2a 08
30: 00 00 00 00 00 00 00 00 00 00 00 00 00 00 00 00

00:1f.3 Audio device [0403]: Intel Corporation Sunrise Point-LP HD Audio [8086:9d71] (rev 21) (prog-if 80)
	Subsystem: Dell Device [1028:082a]
	Flags: bus master, fast devsel, latency 32, IRQ 288
	Memory at dc428000 (64-bit, non-prefetchable) [size=16K]
	Memory at dc400000 (64-bit, non-prefetchable) [size=64K]
	Capabilities: [50] Power Management version 3
	Capabilities: [60] MSI: Enable+ Count=1/1 Maskable- 64bit+
	Kernel driver in use: snd_hda_intel
	Kernel modules: snd_hda_intel, snd_soc_skl
00: 86 80 71 9d 06 04 10 00 21 80 03 04 00 20 00 00
10: 04 80 42 dc 00 00 00 00 00 00 00 00 00 00 00 00
20: 04 00 40 dc 00 00 00 00 00 00 00 00 28 10 2a 08
30: 00 00 00 00 50 00 00 00 00 00 00 00 ff 01 00 00

00:1f.4 SMBus [0c05]: Intel Corporation Sunrise Point-LP SMBus [8086:9d23] (rev 21)
	Subsystem: Dell Device [1028:082a]
	Flags: medium devsel, IRQ 255
	Memory at dc430000 (64-bit, non-prefetchable) [size=256]
	I/O ports at f040 [size=32]
	Kernel modules: i2c_i801
00: 86 80 23 9d 03 00 80 02 21 00 05 0c 00 00 00 00
10: 04 00 43 dc 00 00 00 00 00 00 00 00 00 00 00 00
20: 41 f0 00 00 00 00 00 00 00 00 00 00 28 10 2a 08
30: 00 00 00 00 00 00 00 00 00 00 00 00 ff 01 00 00

3a:00.0 Network controller [0280]: Qualcomm Atheros QCA6174 802.11ac Wireless Network Adapter [168c:003e] (rev 32)
	Subsystem: Bigfoot Networks, Inc. Device [1a56:1535]
	Flags: bus master, fast devsel, latency 0, IRQ 289
	Memory at dc000000 (64-bit, non-prefetchable) [size=2M]
	Capabilities: [40] Power Management version 3
	Capabilities: [50] MSI: Enable+ Count=1/8 Maskable+ 64bit-
	Capabilities: [70] Express Endpoint, MSI 00
	Capabilities: [100] Advanced Error Reporting
	Capabilities: [148] Virtual Channel
	Capabilities: [168] Device Serial Number 00-00-00-00-00-00-00-00
	Capabilities: [178] Latency Tolerance Reporting
	Capabilities: [180] L1 PM Substates
	Kernel driver in use: ath10k_pci
	Kernel modules: ath10k_pci
00: 8c 16 3e 00 06 04 10 00 32 00 80 02 00 00 00 00
10: 04 00 00 dc 00 00 00 00 00 00 00 00 00 00 00 00
20: 00 00 00 00 00 00 00 00 00 00 00 00 56 1a 35 15
30: 00 00 00 00 40 00 00 00 00 00 00 00 ff 01 00 00

3b:00.0 Unassigned class [ff00]: Realtek Semiconductor Co., Ltd. RTS525A PCI Express Card Reader [10ec:525a] (rev 01)
	Subsystem: Dell Device [1028:082a]
	Flags: bus master, fast devsel, latency 0, IRQ 277
	Memory at dc300000 (32-bit, non-prefetchable) [size=4K]
	Capabilities: [80] Power Management version 3
	Capabilities: [90] MSI: Enable+ Count=1/1 Maskable- 64bit+
	Capabilities: [b0] Express Endpoint, MSI 00
	Capabilities: [100] Advanced Error Reporting
	Capabilities: [148] Device Serial Number 00-00-00-01-00-4c-e0-00
	Capabilities: [158] Latency Tolerance Reporting
	Capabilities: [160] L1 PM Substates
	Kernel driver in use: rtsx_pci
	Kernel modules: rtsx_pci
00: ec 10 5a 52 06 04 10 00 01 00 00 ff 00 00 00 00
10: 00 00 00 00 00 00 30 dc 00 00 00 00 00 00 00 00
20: 00 00 00 00 00 00 00 00 00 00 00 00 28 10 2a 08
30: 00 00 00 00 80 00 00 00 00 00 00 00 ff 01 00 00

3c:00.0 Non-Volatile memory controller [0108]: Sandisk Corp Device [15b7:5001] (prog-if 02 [NVM Express])
	Subsystem: Marvell Technology Group Ltd. Device [1b4b:1093]
	Flags: bus master, fast devsel, latency 0, IRQ 16, NUMA node 0
	Memory at dc200000 (64-bit, non-prefetchable) [size=16K]
	Capabilities: [40] Power Management version 3
	Capabilities: [70] Express Endpoint, MSI 00
	Capabilities: [b0] MSI-X: Enable+ Count=19 Masked-
	Capabilities: [100] Advanced Error Reporting
	Capabilities: [148] Device Serial Number 03-4d-ff-7a-99-88-77-66
	Capabilities: [158] Power Budgeting <?>
	Capabilities: [168] Alternative Routing-ID Interpretation (ARI)
	Capabilities: [178] #19
	Capabilities: [2b8] Latency Tolerance Reporting
	Capabilities: [2c0] L1 PM Substates
	Kernel driver in use: nvme
	Kernel modules: nvme
00: b7 15 01 50 06 04 10 00 00 02 08 01 00 00 00 00
10: 04 00 20 dc 00 00 00 00 00 00 00 00 00 00 00 00
20: 00 00 00 00 00 00 00 00 00 00 00 00 4b 1b 93 10
30: 00 00 00 00 40 00 00 00 00 00 00 00 ff 01 00 00

